{
  "schema": "madb.case/1",
  "id": "CASE-LIFE-004-stop-race",
  "kind": "template",
  "problem_ids": [
    "LIFE-004",
    "THR-004"
  ],
  "source_ids": [
    "Rust_C_CPP:13"
  ],
  "selector": null,
  "requires": {
    "features": [],
    "environment": [
      {
        "id": "controllable-callback-barrier",
        "version": "planned"
      },
      {
        "id": "resource-counter",
        "version": "planned"
      }
    ]
  },
  "fixture": {
    "path": "fixtures/planned-subscription.json",
    "schema": "madb.fixture/1",
    "sha256": "sha256:0000000000000000000000000000000000000000000000000000000000000000",
    "size": 0
  },
  "setup": [
    {
      "id": "open",
      "action": "call",
      "entrypoint": "SampleEngine.open",
      "arguments": []
    },
    {
      "id": "register",
      "action": "call",
      "entrypoint": "SampleEngine.registerObserver",
      "arguments": []
    }
  ],
  "steps": [
    {
      "id": "pause-entered",
      "action": "barrier",
      "entrypoint": "Subscription.pauseEnteredCallback",
      "arguments": []
    },
    {
      "id": "request-stop",
      "action": "call",
      "entrypoint": "Subscription.requestStop",
      "arguments": []
    },
    {
      "id": "observe-pending",
      "action": "call",
      "entrypoint": "Subscription.recordStopPending",
      "arguments": []
    },
    {
      "id": "resume-entered",
      "action": "barrier",
      "entrypoint": "Subscription.resumeEnteredCallback",
      "arguments": []
    },
    {
      "id": "await-stopped",
      "action": "call",
      "entrypoint": "Subscription.awaitStopped",
      "arguments": []
    },
    {
      "id": "emit-after-stop",
      "action": "call",
      "entrypoint": "SampleEngine.emitSourceEvent",
      "arguments": []
    }
  ],
  "assertions": [
    {
      "observation": "stop-pending-while-callback-paused",
      "operator": "equals",
      "expected": [
        {
          "kind": "integer",
          "type": "u64",
          "decimal": "1"
        }
      ]
    },
    {
      "observation": "consumer-callbacks-after-stop-completed",
      "operator": "equals",
      "expected": [
        {
          "kind": "integer",
          "type": "u64",
          "decimal": "0"
        }
      ]
    },
    {
      "observation": "context-release-count",
      "operator": "exactly-once",
      "expected": [
        {
          "kind": "integer",
          "type": "u64",
          "decimal": "1"
        }
      ]
    }
  ],
  "expected_result": {
    "kind": "success"
  },
  "cleanup": [
    {
      "id": "close-engine",
      "action": "cleanup",
      "entrypoint": "SampleEngine.close",
      "arguments": []
    },
    {
      "id": "verify-no-live-resources",
      "action": "cleanup",
      "entrypoint": "SampleEngine.verifyNoLiveResources",
      "arguments": []
    }
  ],
  "timeout_policy": {
    "timeout_ms": 5000,
    "on_timeout": "error",
    "recovery": "isolate"
  }
}
